{
  "id": "9b0c1d2e-3f4a-4b5c-9d0e-1f2a3b4c5d6e",
  "type": "fare.payment.refunded",
  "source": "commerce-api",
  "time": "2025-01-15T19:12:44Z",
  "data": {
    "payment_id": "2c4e6f8a-1b3d-4a5c-8e9f-0a1b2c3d4e5f",
    "rider_sub": "citizen",
    "amount_minor": 250,
    "currency": "EUR",
    "tb_transfer_id": "b3f1c2a44d6e4f8a9c0d1e2f3a4b5c6d",
    "refunded_at": "2025-01-15T19:12:43Z"
  }
}
